{
  "id": "zenith",
  "name": "ZENITH",
  "title": "The Setting Sun",
  "faction": "vanguard",
  "archetype": "allrounder",
  "difficulty": 1,
  "stats": {
    "hp": 1000,
    "walkF": 3400,
    "walkB": 2900,
    "dashF": { "speed": 8500, "dur": 14, "tail": 4 },
    "dashB": { "speed": 7800, "dur": 14, "tail": 5 },
    "jumpVy": -12500,
    "gravity": 650,
    "prejump": 4,
    "weight": 3,
    "width": 90,
    "height": 260,
    "crouchHeight": 175
  },
  "rift_button": {
    "mechanic": "flare",
    "config": {
      "debtPerFlare": 10,
      "maxDebt": 100,
      "parryRefundDebt": 10,
      "parryRefundMeter": 50
    }
  },
  "rpg_hook": {
    "id": "solar_debt",
    "persistent": true,
    "state": { "debt": 0 },
    "effects": [
      {
        "trigger": "match_start",
        "action": "modify_stat",
        "target": "self.hp_max",
        "formula": "-min(debt, 15) * 0.01 * base",
        "note": "P4 persistence — carried in data, inert until the persistent layer hydrates state.debt"
      },
      {
        "trigger": "round_won",
        "condition": "flares_this_round == 0",
        "action": "adjust_state",
        "target": "debt",
        "delta": -5
      }
    ]
  },
  "pool_interactions": [],
  "wound_art": { "arms": 3, "legs": 3, "body": 3, "head": 3 },
  "hurtboxes": {
    "stand": [
      { "x": -30, "y": 0, "w": 60, "h": 200 },
      { "x": -20, "y": 200, "w": 40, "h": 60 }
    ],
    "crouch": [
      { "x": -32, "y": 0, "w": 64, "h": 175 }
    ],
    "air": [
      { "x": -30, "y": 40, "w": 60, "h": 180 }
    ]
  },
  "throw": { "range": 45, "damage": 130, "techWindow": 10, "startup": 5 },
  "palette": {
    "primary": "#c9a227",
    "secondary": "#1d2a4a",
    "accent": "#ffd97a",
    "blood": "#ff2135"
  }
}
