{
  "id": "centurion",
  "name": "CENTURION IX",
  "title": "The Ninth Bearer",
  "faction": "vanguard",
  "archetype": "stance-loadout",
  "difficulty": 3,
  "stats": {
    "hp": 1080,
    "walkF": 3300,
    "walkB": 2900,
    "dashF": {
      "speed": 8500,
      "dur": 14,
      "tail": 4
    },
    "dashB": {
      "speed": 7800,
      "dur": 14,
      "tail": 5
    },
    "jumpVy": -26000,
    "gravity": 1300,
    "prejump": 4,
    "weight": 3,
    "width": 90,
    "height": 260,
    "crouchHeight": 175
  },
  "rift_button": {
    "mechanic": "graft_sets",
    "config": {
      "poolMax": 120,
      "poolStart": 120,
      "absorbHeal": 25,
      "armorDamagePermille": 250,
      "power": {
        "dmgPermille": 1000,
        "walkPermille": 930
      },
      "finesse": {
        "walkPermille": 1090,
        "throwStartupMinus": 1,
        "longArmExtend": 0
      }
    }
  },
  "rpg_hook": {
    "id": "centurion_hook",
    "persistent": true,
    "state": {},
    "effects": [
      {
        "trigger": "on_execution",
        "action": "grant_resource",
        "resource": "centurion.harvest",
        "amount": 1,
        "note": "P4+ signature persistence — see the roster doc for the full hook."
      }
    ]
  },
  "pool_interactions": [],
  "wound_art": {
    "arms": 3,
    "legs": 3,
    "body": 3,
    "head": 3
  },
  "hurtboxes": {
    "stand": [
      {
        "x": -30,
        "y": 0,
        "w": 60,
        "h": 200
      },
      {
        "x": -20,
        "y": 200,
        "w": 40,
        "h": 60
      }
    ],
    "crouch": [
      {
        "x": -32,
        "y": 0,
        "w": 64,
        "h": 175
      }
    ],
    "air": [
      {
        "x": -30,
        "y": 40,
        "w": 60,
        "h": 180
      }
    ]
  },
  "throw": {
    "range": 45,
    "damage": 130,
    "techWindow": 10,
    "startup": 5
  },
  "palette": {
    "primary": "#8a97a8",
    "secondary": "#2c3648",
    "accent": "#c9a227",
    "blood": "#ff2135"
  }
}
