{
  "id": "lycaon",
  "name": "LYCAON",
  "title": "The First Wolf",
  "faction": "court",
  "archetype": "transformer",
  "difficulty": 3,
  "stats": {
    "hp": 980,
    "walkF": 3700,
    "walkB": 3400,
    "dashF": {
      "speed": 8200,
      "dur": 14,
      "tail": 4
    },
    "dashB": {
      "speed": 8400,
      "dur": 14,
      "tail": 4
    },
    "jumpVy": -26500,
    "gravity": 1250,
    "prejump": 4,
    "weight": 2,
    "width": 82,
    "height": 262,
    "crouchHeight": 172
  },
  "rift_button": {
    "mechanic": "graft_sets",
    "config": {
      "poolMax": 90,
      "poolStart": 90,
      "absorbHeal": 18,
      "armorDamagePermille": 300,
      "power": {
        "dmgPermille": 1000,
        "walkPermille": 1000
      },
      "finesse": {
        "walkPermille": 1300,
        "throwStartupMinus": 0,
        "longArmExtend": 0
      },
      "labels": {
        "power": "THE MAN",
        "finesse": "THE BEAST"
      }
    }
  },
  "rpg_hook": {
    "id": "lycaon_hook",
    "persistent": true,
    "state": {},
    "effects": [
      {
        "trigger": "on_execution",
        "action": "grant_resource",
        "resource": "lycaon.harvest",
        "amount": 1,
        "note": "P4+ signature persistence — see the roster doc for the full hook."
      }
    ]
  },
  "pool_interactions": [],
  "wound_art": {
    "arms": 3,
    "legs": 3,
    "body": 3,
    "head": 3
  },
  "hurtboxes": {
    "stand": [
      {
        "x": -27,
        "y": 0,
        "w": 54,
        "h": 202
      },
      {
        "x": -19,
        "y": 202,
        "w": 38,
        "h": 60
      }
    ],
    "crouch": [
      {
        "x": -29,
        "y": 0,
        "w": 58,
        "h": 172
      }
    ],
    "air": [
      {
        "x": -27,
        "y": 40,
        "w": 54,
        "h": 182
      }
    ]
  },
  "throw": {
    "range": 45,
    "damage": 120,
    "techWindow": 10,
    "startup": 5
  },
  "palette": {
    "primary": "#6a5140",
    "secondary": "#2c2118",
    "accent": "#c9a227",
    "blood": "#8f0f22"
  }
}
